[
    {
        "name" : "QFile2Snes",
        "author" : "Skarsnik",
        "short-description" : "A software to explore and interact with your sd2snes/fxpak pro files",
        "description" : "Provided with QUsb2Snes. A software to explore your sd2snes/fxpak pro files. It allows you to upload/download file to the sd card. Also support drag and drop from your operating system file explorer.",
        "website" : "https://github.com/Skarsnik/QUsb2snes/tree/master/QFile2Snes",
        "screenshot" : "",
        "icon" : "https://raw.githubusercontent.com/Skarsnik/QUsb2snes/master/QFile2Snes/icon50x50.png",
        "online" : false,
        "github-release" : false,
        "repository" : ""
    },
    {
        "name" : "SaveState2Snes",
        "author" : "Skarsnik",
        "short-description" : "A software to handle your savestates on Sd2snes/Fxpak (pro) and Snes Classic",
        "description" : "A software that use the Usb2Snes firmware to allow you to save, load and organize savestates for your SNES games. Also support the SNES Classic with a special mod for Hakchi2 CE",
        "website" : "https://skarsnik.github.io/Savestate2snes/",
        "screenshot" : "https://skarsnik.github.io/Savestate2snes/webimage/main.png",
        "icon" : "https://raw.githubusercontent.com/Skarsnik/Savestate2snes/master/Icon126x126.png",
        "online" : false ,
        "github-release" : true,
        "repository" : "https://github.com/Skarsnik/Savestate2snes"
    },
    {
       "name"  : "Multitroid",
       "author" : "OsteHovel",
       "short-description" : "A way to play Super Metroid with shared inventory/ammunition/heal point accross multiple players",
       "description" : "A way to play Super Metroid with shared inventory/ammunition/heal point accross multiple players",
       "website" :  "http://www.multitroid.com",
       "screenshot" :  "todo.png",
       "icon" : "url to icon",
       "online" :  true,
       "github-release" : false,
       "repository" : "none"
    },
    {
        "name" : "PopTracker",
        "author" : "black-sliver",
        "short-description" : "Scriptable auto map-tracker, compatible to existing packs",
        "description" : "Powerful open progress tracker is a project to offer a universal, scriptable randomizer tracking solution that it is open source, runs everywhere and supports auto-tracking",
        "website" : "https://github.com/black-sliver/PopTracker",
        "screenshot" : "https://raw.githubusercontent.com/black-sliver/PopTracker/screenshots/screenshot.png",
        "icon" : "",
        "online" : false ,
        "github-release" : true,
        "repository" : "https://github.com/black-sliver/PopTracker"
    }
  
]
